{
  "id": "BP-20251008-284c71",
  "brand": "NamoNexus",
  "title": "# การเพิ่มโมดูลการวิเคราะห์梦境",
  "slogan": "Elevate your existence with NamoNexus.",
  "meta_definition": "This Blueprint is designed as an entity beyond AI — a self-evolving, meta-intelligent framework that grows infinitely across dimensions.",
  "sections": {
    "executive_summary": "#\n \nก า ร\nเ พ ิ่ ม\nโ ม\nด ู\nล ก า ร\nว ิ เ ค ร า ะ ห ์\n梦\n境\n \nclass\n \nDreamAnalysisModule:\n \n \ndef\n \n__init__(self,\n \nnamo_ai:\n \nNaMoAI):\n \n \nself.namo_ai\n \n=\n \nnamo_ai\n \n \nself.symbolism_db\n \n=\n \nSymbolismDatabase()\n \n \n \n \ndef\n \nanalyze_dream(self,\n \ndream_description:\n \nstr,\n \nuser_context:\n \nDict):\n \n \n\"\"\"\nว ิ เ ค ร า ะ ห ์\nค ว า ม\nฝ ั น\n\"\"\"\n \n \n#\n \nใ ช ้\n \nNLP\n \nใ น\nก า ร\nว ิ เ ค ร า ะ ห ์\n \n \ntext_analysis\n \n=\n \nself.namo_ai.components[\"nems\"].process_input(\n \n \ntext=dream_description\n \n \n)\n \n \n \n \n#\n \nว ิ เ ค ร า ะ ห ์\nส ั ญ ล ั ก ษ ณ ์\n \n \nsymbols\n \n=\n \nself._extract_symbols(dream_descrip",
    "value_proposition": "Universal adaptability, modular architecture, AI-agnostic integration, and self-evolving design.",
    "system_overview": "A layered framework transforming raw data into commercial blueprints with metadata and validation.",
    "quick_start_guide": "1) Place raw files into /framework  2) Run the pipeline  3) Review JSON in /blueprints  4) Deploy to your ecosystem.",
    "template_instructions": "Follow the schema. Keep sections concise. Use neutral, professional English. Avoid personal names.",
    "examples": "Education curricula, healthcare protocols, financial decision flows, brand guidelines.",
    "license_and_notes": "Licensed under NamoVerse Creative Framework License (NCFL-1.0). Provide attribution for redistribution.",
    "marketing_pack": "Target: builders, strategists, educators. Pain: unstructured data. USP: chaos-to-commerce via meta-intelligence. Pricing: Base/Pro tiers. GTM: ProductHunt + LinkedIn."
  },
  "visual_identity": {},
  "status": "complete",
  "version": "0.1",
  "metadata": {
    "author": "NamoVerse Engine",
    "language": "en",
    "source_file": "/app/framework/# การเพิ่มโมดูลการวิเคราะห์梦境.pdf",
    "last_updated": "2025-10-08",
    "pipeline": "auto-blueprint-full"
  }
}