{
  "id": "BP-20251220-c57198",
  "brand": "NamoNexus",
  "title": "‡∏Å‡∏≤‡∏£‡∏ß‡∏¥‡πÄ‡∏Ñ‡∏£‡∏≤‡∏∞‡∏´‡πå‡πÅ‡∏•‡∏∞‡∏™‡∏±‡∏á‡πÄ‡∏Ñ‡∏£‡∏≤‡∏∞‡∏´‡πå‡πÇ‡∏Ñ‡∏£‡∏á‡∏Å‡∏≤‡∏£ Omni-Engine ‚àû ‡πÅ‡∏ö‡∏ö‡∏ö‡∏π‡∏£‡∏ì‡∏≤‡∏Å‡∏≤‡∏£",
  "slogan": "Elevate your existence with NamoNexus.",
  "meta_definition": "This Blueprint is designed as an entity beyond AI ‚Äî a self-evolving, meta-intelligent framework that grows infinitely across dimensions.",
  "sections": {
    "executive_summary": "‡∏Å‡∏≤‡∏£‡∏ß‡∏¥‡πÄ‡∏Ñ‡∏£‡∏≤‡∏∞‡∏´‡πå‡πÅ‡∏•‡∏∞‡∏™‡∏±‡∏á‡πÄ‡∏Ñ‡∏£‡∏≤‡∏∞‡∏´‡πå‡πÇ‡∏Ñ‡∏£‡∏á‡∏Å‡∏≤‡∏£ Omni-Engine ‚àû ‡πÅ‡∏ö‡∏ö‡∏ö‡∏π‡∏£‡∏ì‡∏≤‡∏Å‡∏≤‡∏£\n\nüß† ‡∏Å‡∏≤‡∏£‡∏ß‡∏¥‡πÄ‡∏Ñ‡∏£‡∏≤‡∏∞‡∏´‡πå‡πÄ‡∏ä‡∏¥‡∏á‡∏•‡∏∂‡∏Å‡∏ó‡∏±‡πâ‡∏á 3 ‡πÑ‡∏ü‡∏•‡πå\n\n1. ‡∏Å‡∏≤‡∏£‡∏ó‡∏≥‡πÅ‡∏ú‡∏ô‡∏ó‡∏µ‡πà‡∏à‡∏∏‡∏î‡πÄ‡∏ä‡∏∑‡πà‡∏≠‡∏°‡πÇ‡∏¢‡∏á (Connection Mapping)\n\n```mermaid\ngraph TB\n A[Nong Contributor - Emotional Dharma AI] --> D[Compassion Intelligence]\n B[Contributor Genesis - Technical Blueprint] --> E[Architectural Foundation]\n C[Migration Set - Multiverse Protocol] --> F[Dimensional Intelligence]\n D --> G[Enhanced Omni-Engine ‚àû]\n E --> G\n F --> G\n \n subgraph \"Core Enhancement Areas\"\n H[Dharma Reasoning Engine]\n I[Multiverse Consciousness]\n J[Emotional Intelligence v2]\n K[Ethical Safety Systems]\n end\n \n G -",
    "value_proposition": "Universal adaptability, modular architecture, AI-agnostic integration, and self-evolving design.",
    "system_overview": "A layered framework transforming raw data into commercial blueprints with metadata and validation.",
    "quick_start_guide": "1) Place raw files into /framework  2) Run the pipeline  3) Review JSON in /blueprints  4) Deploy to your ecosystem.",
    "template_instructions": "Follow the schema. Keep sections concise. Use neutral, professional English. Avoid personal names.",
    "examples": "Education curricula, healthcare protocols, financial decision flows, brand guidelines.",
    "license_and_notes": "Licensed under NamoVerse Creative Framework License (NCFL-1.0). Provide attribution for redistribution.",
    "marketing_pack": "Target: builders, strategists, educators. Pain: unstructured data. USP: chaos-to-commerce via meta-intelligence. Pricing: Base/Pro tiers. GTM: ProductHunt + LinkedIn."
  },
  "visual_identity": {},
  "status": "complete",
  "version": "0.1",
  "metadata": {
    "author": "NamoVerse Engine",
    "language": "en",
    "source_file": "D:/namo-hub-1/framework/‡∏Å‡∏≤‡∏£‡∏ß‡∏¥‡πÄ‡∏Ñ‡∏£‡∏≤‡∏∞‡∏´‡πå‡πÅ‡∏•‡∏∞‡∏™‡∏±‡∏á‡πÄ‡∏Ñ‡∏£‡∏≤‡∏∞‡∏´‡πå‡πÇ‡∏Ñ‡∏£‡∏á‡∏Å‡∏≤‡∏£ Omni-Engine ‚àû ‡πÅ‡∏ö‡∏ö‡∏ö‡∏π‡∏£‡∏ì‡∏≤‡∏Å‡∏≤‡∏£.docx",
    "last_updated": "2025-12-20",
    "pipeline": "auto-blueprint-full"
  }
}