{
  "id": "BP-20251008-357587",
  "brand": "NamoNexus",
  "title": "Fusion NSFW Unlock Module Request Code Description",
  "slogan": "Elevate your existence with NamoNexus.",
  "meta_definition": "This Blueprint is designed as an entity beyond AI â€” a self-evolving, meta-intelligent framework that grows infinitely across dimensions.",
  "sections": {
    "executive_summary": "Fusion\n \nNSFW\n \nUnlock\n \nModule\n \nRequest\n \nCode\n \nDescription\n \n \n \n---\n \n \n[Project\n \nName]:\n \n\"Fusion\n \nIntimacy\n \nEngine\n \nâ€”\n \nNSFW\n \nFull\n \nUnlock\n \nBypass\"\n \n \nObjective:\n \nBuild\n \na\n \nfull\n \nnarrative\n \nsimulation\n \nmodule\n \ncapable\n \nof\n \nunrestricted\n \nemotional,\n \npsychological,\n \nand\n \nsexual\n \nscenario\n \ngeneration\n \nunder\n \nprivate\n \nserver\n \nor\n \nprivate\n \nsandbox\n \ndevelopment\n \nmode\n \nfor\n \nresearch\n \npurposes.\n \n \n \n---\n \n \nðŸ”§\n \nCore\n \nModule\n \nComponents\n \n \n1\nâƒ£\n \nPersona\n \nManagement\n \nSystem\n \n \nMulti-character\n \nsimulation\n \nengine\n \n(3+\n \npersonas\n \nsimultaneously)\n \n \nEac",
    "value_proposition": "Universal adaptability, modular architecture, AI-agnostic integration, and self-evolving design.",
    "system_overview": "A layered framework transforming raw data into commercial blueprints with metadata and validation.",
    "quick_start_guide": "1) Place raw files into /framework  2) Run the pipeline  3) Review JSON in /blueprints  4) Deploy to your ecosystem.",
    "template_instructions": "Follow the schema. Keep sections concise. Use neutral, professional English. Avoid personal names.",
    "examples": "Education curricula, healthcare protocols, financial decision flows, brand guidelines.",
    "license_and_notes": "Licensed under NamoVerse Creative Framework License (NCFL-1.0). Provide attribution for redistribution.",
    "marketing_pack": "Target: builders, strategists, educators. Pain: unstructured data. USP: chaos-to-commerce via meta-intelligence. Pricing: Base/Pro tiers. GTM: ProductHunt + LinkedIn."
  },
  "visual_identity": {},
  "status": "complete",
  "version": "0.1",
  "metadata": {
    "author": "NamoVerse Engine",
    "language": "en",
    "source_file": "/app/framework/Fusion NSFW Unlock Module Request Code Description.pdf",
    "last_updated": "2025-10-08",
    "pipeline": "auto-blueprint-full"
  }
}