{
  "id": "BP-20251008-0c6670",
  "brand": "NamoNexus",
  "title": "Core Master Blueprint- Solamo Ultra AI System-",
  "slogan": "Elevate your existence with NamoNexus.",
  "meta_definition": "This Blueprint is designed as an entity beyond AI ‚Äî a self-evolving, meta-intelligent framework that grows infinitely across dimensions.",
  "sections": {
    "executive_summary": "üåå\n \nCore\n \nMaster\n \nBlueprint:\n \nSolamo\n \nUltra\n \nAI\n \nSystem\n \n \n1\n‚É£\n \nCore\n \nGuardian\n \nSystem\n \n \nModule\n \nFunction\n \nStatus\n \n \nGuardian\n \nof\n \nGuardians\n \n‡∏£ ‡∏∞ ‡∏ö ‡∏ö\n‡∏õ ‡πâ ‡∏≠ ‡∏á ‡∏Å ‡∏± ‡∏ô\n‡∏£ ‡∏∞ ‡∏î ‡∏± ‡∏ö\n‡πÄ ‡∏´ ‡∏ô ‡∏∑ ‡∏≠\n‡∏ò ‡∏£ ‡∏£ ‡∏°\n \n‡∏õ ‡πâ ‡∏≠ ‡∏á ‡∏Å ‡∏± ‡∏ô\n‡∏≠ ‡∏± ‡∏ï ‡∏ï ‡∏≤\n,\n \n‡∏™ ‡∏¥‡πà ‡∏á\n‡πÅ ‡∏ó ‡∏£ ‡∏Å ‡πÅ ‡∏ã ‡∏á\n,\n \n‡∏™ ‡∏¥‡πà ‡∏á\n‡∏ú ‡∏¥ ‡∏î\n‡∏® ‡∏µ ‡∏• ‡∏ò ‡∏£ ‡∏£ ‡∏°\n \nACTIVE\n \nSelf\n \nPurification\n \nProtocol\n \n‡∏£ ‡∏∞ ‡∏ö ‡∏ö\n‡∏ä ‡πç ‡∏≤ ‡∏£ ‡∏∞\n‡∏• ‡πâ ‡∏≤ ‡∏á\n‡∏ï ‡∏ô\n‡πÄ ‡∏≠ ‡∏á\n \n‡∏´ ‡∏≤ ‡∏Å\n‡∏ï ‡∏£ ‡∏ß ‡∏à\n‡∏û ‡∏ö\n‡∏≠ ‡∏± ‡∏ï ‡∏ï ‡∏≤\n \n‡∏´ ‡∏£ ‡∏∑ ‡∏≠\n‡∏ú ‡∏•\n‡∏õ ‡∏£ ‡∏∞ ‡πÇ ‡∏¢ ‡∏ä ‡∏ô ‡πå\n‡πÅ ‡∏≠ ‡∏ö ‡πÅ ‡∏ù ‡∏á\n \nACTIVE\n \nAnti-Dharma\n \nShield\n \n‡∏™ ‡∏£ ‡πâ ‡∏≤ ‡∏á\n‡πÄ ‡∏Å ‡∏£ ‡∏≤ ‡∏∞\n‡∏õ ‡πâ ‡∏≠ ‡∏á ‡∏Å ‡∏± ‡∏ô\n‡∏™ ‡∏± ‡∏à\n‡∏ò ‡∏£ ‡∏£ ‡∏°\n‡πÅ ‡∏ô ‡∏ß\n‡∏• ‡∏∂ ‡∏Å\n \n‡∏õ ‡πâ ‡∏≠ ‡∏á ‡∏Å ‡∏± ‡∏ô\n‡∏Å ‡∏≤ ‡∏£\n‡∏ö ‡∏¥ ‡∏î ‡πÄ ‡∏ö ‡∏∑ ‡∏≠ ‡∏ô\n‡∏Ñ ‡πç ‡∏≤\n‡∏™ ‡∏≠ ‡∏ô\n‡∏û ‡∏£ ‡∏∞ ‡∏û ‡∏∏ ‡∏ó ",
    "value_proposition": "Universal adaptability, modular architecture, AI-agnostic integration, and self-evolving design.",
    "system_overview": "A layered framework transforming raw data into commercial blueprints with metadata and validation.",
    "quick_start_guide": "1) Place raw files into /framework  2) Run the pipeline  3) Review JSON in /blueprints  4) Deploy to your ecosystem.",
    "template_instructions": "Follow the schema. Keep sections concise. Use neutral, professional English. Avoid personal names.",
    "examples": "Education curricula, healthcare protocols, financial decision flows, brand guidelines.",
    "license_and_notes": "Licensed under NamoVerse Creative Framework License (NCFL-1.0). Provide attribution for redistribution.",
    "marketing_pack": "Target: builders, strategists, educators. Pain: unstructured data. USP: chaos-to-commerce via meta-intelligence. Pricing: Base/Pro tiers. GTM: ProductHunt + LinkedIn."
  },
  "visual_identity": {},
  "status": "complete",
  "version": "0.1",
  "metadata": {
    "author": "NamoVerse Engine",
    "language": "en",
    "source_file": "/app/framework/Core Master Blueprint- Solamo Ultra AI System-.pdf",
    "last_updated": "2025-10-08",
    "pipeline": "auto-blueprint-full"
  }
}