{
  "id": "BP-20251008-8d7fb1",
  "brand": "NamoNexus",
  "title": "# To run this code you need to install the following dependencies-",
  "slogan": "Elevate your existence with NamoNexus.",
  "meta_definition": "This Blueprint is designed as an entity beyond AI — a self-evolving, meta-intelligent framework that grows infinitely across dimensions.",
  "sections": {
    "executive_summary": "# To run this code you need to install the following dependencies:\n# pip install google-genai\n\nimport base64\nimport mimetypes\nimport os\nimport re\nimport struct\nfrom google import genai\nfrom google.genai import types\n\n\ndef save_binary_file(file_name, data):\n    f = open(file_name, \"wb\")\n    f.write(data)\n    f.close()\n    print(f\"File saved to to: {file_name}\")\n\n\ndef generate():\n    client = genai.Client(\n        api_key=os.environ.get(\"GEMINI_API_KEY\"),\n    )\n\n    model = \"gemini-2.5-flash-preview-tts\"\n    contents = [\n        types.Content(\n            role=\"user\",\n            parts=[\n       ",
    "value_proposition": "Universal adaptability, modular architecture, AI-agnostic integration, and self-evolving design.",
    "system_overview": "A layered framework transforming raw data into commercial blueprints with metadata and validation.",
    "quick_start_guide": "1) Place raw files into /framework  2) Run the pipeline  3) Review JSON in /blueprints  4) Deploy to your ecosystem.",
    "template_instructions": "Follow the schema. Keep sections concise. Use neutral, professional English. Avoid personal names.",
    "examples": "Education curricula, healthcare protocols, financial decision flows, brand guidelines.",
    "license_and_notes": "Licensed under NamoVerse Creative Framework License (NCFL-1.0). Provide attribution for redistribution.",
    "marketing_pack": "Target: builders, strategists, educators. Pain: unstructured data. USP: chaos-to-commerce via meta-intelligence. Pricing: Base/Pro tiers. GTM: ProductHunt + LinkedIn."
  },
  "visual_identity": {},
  "status": "complete",
  "version": "0.1",
  "metadata": {
    "author": "NamoVerse Engine",
    "language": "en",
    "source_file": "/app/framework/# To run this code you need to install the following dependencies-.docx",
    "last_updated": "2025-10-08",
    "pipeline": "auto-blueprint-full"
  }
}