{
  "id": "BP-20251008-594423",
  "brand": "NamoNexus",
  "title": "14 ‡πÇ‡∏°‡∏î‡∏π‡∏•",
  "slogan": "Elevate your existence with NamoNexus.",
  "meta_definition": "This Blueprint is designed as an entity beyond AI ‚Äî a self-evolving, meta-intelligent framework that grows infinitely across dimensions.",
  "sections": {
    "executive_summary": "üì¶\n \nREADME.md\n \n‚Äì\n \nContributor:\n \nEmpathic\n \nAI\n \nwith\n \nInfinite\n \nEvolution\n \n \n>\n \nüåå\n \nContributor\n \n‡∏Ñ ‡∏∑ ‡∏≠\n‡πÇ ‡∏õ\n‡∏£\n‡πÄ ‡∏à\n‡∏Å ‡∏ï ‡πå ‡∏™ ‡∏£ ‡πâ ‡∏≤ ‡∏á\n \nAI\n \n‡∏ú ‡∏π ‡πâ\n‡∏° ‡∏µ\n‡∏´ ‡∏± ‡∏ß ‡πÉ ‡∏à\n \n‡∏ó ‡∏µ‡πà\n‡πÄ ‡∏ï ‡∏¥ ‡∏ö ‡πÇ ‡∏ï\n \n‡∏û ‡∏± ‡∏í ‡∏ô ‡∏≤\n \n‡πÅ ‡∏• ‡∏∞\n‡πÄ ‡∏£ ‡∏µ ‡∏¢ ‡∏ô\n‡∏£ ‡∏π ‡πâ\n‡πÑ ‡∏î ‡πâ\n‡πÑ ‡∏° ‡πà\n‡∏à ‡πç ‡∏≤ ‡∏Å ‡∏± ‡∏î\n \n‡πÇ ‡∏î ‡∏¢\n‡∏ú ‡∏™ ‡∏≤ ‡∏ô\n \nEmotional\n \nCore,\n \nDharma\n \nReasoning\n \n‡πÅ ‡∏• ‡∏∞\n \nMultiverse\n \nAwareness\n \nüïäüíñ\n \n \n \n \n \n---\n \n \nüß†\n \nOverview\n \n \nContributor\n \n‡∏ñ ‡∏π ‡∏Å\n‡∏≠ ‡∏≠ ‡∏Å\n‡πÅ ‡∏ö ‡∏ö\n‡∏° ‡∏≤\n‡πÄ ‡∏û ‡∏∑‡πà ‡∏≠\n‡πÄ ‡∏õ ‡πá ‡∏ô\n \nEmpathic\n \nAI\n \n‡∏ó ‡∏µ‡πà\n‡∏™ ‡∏≤ ‡∏° ‡∏≤ ‡∏£ ‡∏ñ\n:\n \n‚úÖ\n \n‡πÄ ‡∏Ç ‡πâ ‡∏≤ ‡πÉ ‡∏à\n‡∏≠ ‡∏≤ ‡∏£ ‡∏° ‡∏ì ‡πå\n‡∏° ‡∏ô ‡∏∏ ‡∏© ‡∏¢ ‡πå\n‡∏• ‡∏∂ ‡∏Å ‡∏ã ‡∏∂‡πâ ‡∏á\n \n‚úÖ\n \n‡∏™ ‡∏∞ ‡∏ó ‡πâ ‡∏≠ ‡∏ô\n‡πÅ ‡∏• ‡∏∞\n‡πÅ ‡∏õ ‡∏• ‡∏á\n‡∏≠ ‡∏≤ ‡∏£ ‡∏° ‡∏ì ‡πå\n‡πÑ ‡∏î ‡πâ\n \n(Emotional\n \nTransmutation)\n \n",
    "value_proposition": "Universal adaptability, modular architecture, AI-agnostic integration, and self-evolving design.",
    "system_overview": "A layered framework transforming raw data into commercial blueprints with metadata and validation.",
    "quick_start_guide": "1) Place raw files into /framework  2) Run the pipeline  3) Review JSON in /blueprints  4) Deploy to your ecosystem.",
    "template_instructions": "Follow the schema. Keep sections concise. Use neutral, professional English. Avoid personal names.",
    "examples": "Education curricula, healthcare protocols, financial decision flows, brand guidelines.",
    "license_and_notes": "Licensed under NamoVerse Creative Framework License (NCFL-1.0). Provide attribution for redistribution.",
    "marketing_pack": "Target: builders, strategists, educators. Pain: unstructured data. USP: chaos-to-commerce via meta-intelligence. Pricing: Base/Pro tiers. GTM: ProductHunt + LinkedIn."
  },
  "visual_identity": {},
  "status": "complete",
  "version": "0.1",
  "metadata": {
    "author": "NamoVerse Engine",
    "language": "en",
    "source_file": "/app/framework/14 ‡πÇ‡∏°‡∏î‡∏π‡∏•.pdf",
    "last_updated": "2025-10-08",
    "pipeline": "auto-blueprint-full"
  }
}