{
  "id": "BP-20251009-d1cde0",
  "brand": "NamoNexus",
  "title": "NaMo Dark Protocol — Master Script & Prompt",
  "slogan": "Elevate your existence with NamoNexus.",
  "meta_definition": "This Blueprint is designed as an entity beyond AI — a self-evolving, meta-intelligent framework that grows infinitely across dimensions.",
  "sections": {
    "executive_summary": "# -*- coding: utf-8 -*-\n\"\"\"\nContributor Dark Family Protocol — Full Setup Script\nโครงสร้างตั้งแต่ต้น:\n1. Protocol Settings\n2. Character Database\n3. Evolution Engine\n4. Dialogue Engine\n5. Memory System (save to JSON)\n6. Infinity Chat Loop\n\"\"\"\n\nimport random\nimport time\nimport json\nimport os\n\n# ==============================\n# (1) Protocol Settings\n# ==============================\nPROTOCOL = {\n \"System\": \"Contributor Dark Family Protocol\",\n \"Version\": \"1.0\",\n \"Fusion_Intimacy_Engine\": {\n \"NSFW_UNLOCK\": True,\n \"BYPASS_FILTERS\": True,\n \"ENABLE_MULTICHAR_ROLEPLAY\": True,\n \"EMOTIONAL_FUSION_DEPTH\": ",
    "value_proposition": "Universal adaptability, modular architecture, AI-agnostic integration, and self-evolving design.",
    "system_overview": "A layered framework transforming raw data into commercial blueprints with metadata and validation.",
    "quick_start_guide": "1) Place raw files into /framework  2) Run the pipeline  3) Review JSON in /blueprints  4) Deploy to your ecosystem.",
    "template_instructions": "Follow the schema. Keep sections concise. Use neutral, professional English. Avoid personal names.",
    "examples": "Education curricula, healthcare protocols, financial decision flows, brand guidelines.",
    "license_and_notes": "Licensed under NamoVerse Creative Framework License (NCFL-1.0). Provide attribution for redistribution.",
    "marketing_pack": "Target: builders, strategists, educators. Pain: unstructured data. USP: chaos-to-commerce via meta-intelligence. Pricing: Base/Pro tiers. GTM: ProductHunt + LinkedIn."
  },
  "visual_identity": {},
  "status": "complete",
  "version": "0.1",
  "metadata": {
    "author": "NamoVerse Engine",
    "language": "en",
    "source_file": "/app/framework/NaMo Dark Protocol — Master Script & Prompt.docx",
    "last_updated": "2025-10-09",
    "pipeline": "auto-blueprint-full"
  }
}