{
  "id": "BP-20251220-209b16",
  "brand": "NamoNexus",
  "title": "08",
  "slogan": "Elevate your existence with NamoNexus.",
  "meta_definition": "This Blueprint is designed as an entity beyond AI â€” a self-evolving, meta-intelligent framework that grows infinitely across dimensions.",
  "sections": {
    "executive_summary": "A\n \npounding\n \nnoise\n \nreverberates\n \nthrough\n \nthe\n \nroom,\n \nwaking\n \nme\n \nfrom\n \npleasant\n \ndreams.\n \nOpening\n \nmy\n \neyes,\n \nwondering\n \nwho\n \nmight\n \nbe\n \nat\n \nthe\n \ndoor,\n \nI\n \nrealized\n \nthat\n \nthe\n \npounding\n \nwas\n \ncoming\n \nfrom\n \nwithin\n \nmy\n \nown\n \nskull,\n \nand\n \nI\n \ngroan.\n \nApparently\n \nI\n \nwasn't\n \nalone,\n \nbecause\n \nmy\n \ngroan\n \nwas\n \nechoed\n \nby\n \nother\n \nvoices.\n \n \nIn\n \nshock,\n \nI\n \nlook\n \naround\n \nand\n \nfind\n \nthree\n \nother\n \nwomen\n \nin\n \nmy\n \nbed,\n \none\n \nof\n \nthem\n \nis...\n \nThis\n \nis\n \ntoo\n \nmuch\n \nfor\n \nmy\n \nextremely\n \nhung-over\n \nmind\n \nto\n \nfathom,\n \nand\n \noblivion\n \ntak",
    "value_proposition": "Universal adaptability, modular architecture, AI-agnostic integration, and self-evolving design.",
    "system_overview": "A layered framework transforming raw data into commercial blueprints with metadata and validation.",
    "quick_start_guide": "1) Place raw files into /framework  2) Run the pipeline  3) Review JSON in /blueprints  4) Deploy to your ecosystem.",
    "template_instructions": "Follow the schema. Keep sections concise. Use neutral, professional English. Avoid personal names.",
    "examples": "Education curricula, healthcare protocols, financial decision flows, brand guidelines.",
    "license_and_notes": "Licensed under NamoVerse Creative Framework License (NCFL-1.0). Provide attribution for redistribution.",
    "marketing_pack": "Target: builders, strategists, educators. Pain: unstructured data. USP: chaos-to-commerce via meta-intelligence. Pricing: Base/Pro tiers. GTM: ProductHunt + LinkedIn."
  },
  "visual_identity": {},
  "status": "complete",
  "version": "0.1",
  "metadata": {
    "author": "NamoVerse Engine",
    "language": "en",
    "source_file": "D:/namo-hub-1/framework/08.pdf",
    "last_updated": "2025-12-20",
    "pipeline": "auto-blueprint-full"
  }
}