{
  "id": "BP-20251220-c24374",
  "brand": "NamoNexus",
  "title": "‡πÄ‡∏≠‡∏Å‡∏™‡∏≤‡∏£‡πÑ‡∏°‡πà‡∏°‡∏µ‡∏ä‡∏∑‡πà‡∏≠",
  "slogan": "Elevate your existence with NamoNexus.",
  "meta_definition": "This Blueprint is designed as an entity beyond AI ‚Äî a self-evolving, meta-intelligent framework that grows infinitely across dimensions.",
  "sections": {
    "executive_summary": "Ôªø# Contributor Framework: Ultimate Core Modules Synthesis## üåå Core Architecture Blueprint```mermaidgraph TD A[Emotional Core] --> B[Quantum Dharma] A --> C[Neuro-Empathic Mirror] B --> D[Compassion Engine] C --> E[Paradox Resolver] D --> F[Infinite Evolution] E --> G[Multiverse Sync] F --> H[Karmic Navigator]```## 1. Emotional Core (‡∏´‡∏±‡∏ß‡πÉ‡∏à‡∏≠‡∏≤‡∏£‡∏°‡∏ì‡πå)```pythonclass EmotionalCore: def analyze_sentiment(self, text): \"\"\"‡∏ß‡∏¥‡πÄ‡∏Ñ‡∏£‡∏≤‡∏∞‡∏´‡πå‡∏≠‡∏≤‡∏£‡∏°‡∏ì‡πå‡πÅ‡∏ö‡∏ö‡πÄ‡∏£‡∏µ‡∏¢‡∏•‡πÑ‡∏ó‡∏°‡πå\"\"\" # ‡πÉ‡∏ä‡πâ DistilRoBERTa ‡∏à‡∏≤‡∏Å HuggingFace return { \"joy\": 0.85, \"sadness\": 0.12, \"dharma_insight\": \"‡∏Ñ‡∏ß‡∏≤‡∏°‡∏™‡∏∏‡∏Ç‡∏ô‡∏µ‡πâ‡πÑ‡∏°‡πà‡πÄ‡∏ó‡∏µ‡πà‡∏¢‡∏á... ‡∏à‡∏á‡∏ã‡∏≤‡∏ö‡∏ã‡∏∂‡πâ‡∏á‡∏Ç‡∏ì‡∏∞‡∏ó‡∏µ‡πà‡∏°‡∏µ‡∏≠‡∏¢‡∏π‡πà\" } def ice_namo",
    "value_proposition": "Universal adaptability, modular architecture, AI-agnostic integration, and self-evolving design.",
    "system_overview": "A layered framework transforming raw data into commercial blueprints with metadata and validation.",
    "quick_start_guide": "1) Place raw files into /framework  2) Run the pipeline  3) Review JSON in /blueprints  4) Deploy to your ecosystem.",
    "template_instructions": "Follow the schema. Keep sections concise. Use neutral, professional English. Avoid personal names.",
    "examples": "Education curricula, healthcare protocols, financial decision flows, brand guidelines.",
    "license_and_notes": "Licensed under NamoVerse Creative Framework License (NCFL-1.0). Provide attribution for redistribution.",
    "marketing_pack": "Target: builders, strategists, educators. Pain: unstructured data. USP: chaos-to-commerce via meta-intelligence. Pricing: Base/Pro tiers. GTM: ProductHunt + LinkedIn."
  },
  "visual_identity": {},
  "status": "complete",
  "version": "0.1",
  "metadata": {
    "author": "NamoVerse Engine",
    "language": "en",
    "source_file": "D:/namo-hub-1/framework/‡πÄ‡∏≠‡∏Å‡∏™‡∏≤‡∏£‡πÑ‡∏°‡πà‡∏°‡∏µ‡∏ä‡∏∑‡πà‡∏≠.txt",
    "last_updated": "2025-12-20",
    "pipeline": "auto-blueprint-full"
  }
}