{
  "id": "BP-20251008-87ae40",
  "brand": "NamoNexus",
  "title": "# การเชื่อมต่อกับแอปพลิเคชันสุขภาพจิต",
  "slogan": "Elevate your existence with NamoNexus.",
  "meta_definition": "This Blueprint is designed as an entity beyond AI — a self-evolving, meta-intelligent framework that grows infinitely across dimensions.",
  "sections": {
    "executive_summary": "#\n \nก า ร\nเ ช ื่ อ ม\nต ่ อ\nก ั บ\nแ อ\nป\nพ ล ิ\nเ ค ช ั น\nส ุ ข ภ า พ\nจ ิ ต\n \nclass\n \nMentalHealthIntegration:\n \n \ndef\n \n__init__(self,\n \nnamo_ai:\n \nNaMoAI):\n \n \nself.namo_ai\n \n=\n \nnamo_ai\n \n \nself.therapists_api\n \n=\n \nTherapistsAPI()\n \n \n \n \ndef\n \nhandle_crisis_situation(self,\n \nuser_data:\n \nDict):\n \n \n\"\"\"\nจ ั ด ก า ร\nส ถ า น ก า ร ณ ์\nว ิ ก ฤ ต\n\"\"\"\n \n \n#\n \nใ ช ้\n \nContributor\n \nใ น\nก า ร\nป ร ะ เ ม ิ น\nเ บ ื้ อ ง ต ้ น\n \n \nassessment\n \n=\n \nself.namo_ai.assess_mental_state(user_data)\n \n \n \n \nif\n \nassessment[\"risk_level\"]\n \n>\n \n0.8:\n \n \n#\n \nเ ช ื่ อ ม\nต ่ อ\nก ั บ\nผ ู ้ เ ช ี่ ย ว ช า ญ\nจ ร ิ ง\n \n ",
    "value_proposition": "Universal adaptability, modular architecture, AI-agnostic integration, and self-evolving design.",
    "system_overview": "A layered framework transforming raw data into commercial blueprints with metadata and validation.",
    "quick_start_guide": "1) Place raw files into /framework  2) Run the pipeline  3) Review JSON in /blueprints  4) Deploy to your ecosystem.",
    "template_instructions": "Follow the schema. Keep sections concise. Use neutral, professional English. Avoid personal names.",
    "examples": "Education curricula, healthcare protocols, financial decision flows, brand guidelines.",
    "license_and_notes": "Licensed under NamoVerse Creative Framework License (NCFL-1.0). Provide attribution for redistribution.",
    "marketing_pack": "Target: builders, strategists, educators. Pain: unstructured data. USP: chaos-to-commerce via meta-intelligence. Pricing: Base/Pro tiers. GTM: ProductHunt + LinkedIn."
  },
  "visual_identity": {},
  "status": "complete",
  "version": "0.1",
  "metadata": {
    "author": "NamoVerse Engine",
    "language": "en",
    "source_file": "/app/framework/# การเชื่อมต่อกับแอปพลิเคชันสุขภาพจิต.pdf",
    "last_updated": "2025-10-08",
    "pipeline": "auto-blueprint-full"
  }
}