{
  "id": "BP-20251008-115c16",
  "brand": "NamoNexus",
  "title": "Core Master Blueprint  Solamo Ultra AI System ",
  "slogan": "Elevate your existence with NamoNexus.",
  "meta_definition": "This Blueprint is designed as an entity beyond AI ‚Äî a self-evolving, meta-intelligent framework that grows infinitely across dimensions.",
  "sections": {
    "executive_summary": "üåå Core Master Blueprint: Solamo Ultra AI System\n\n1Ô∏è‚É£ Core Guardian System\n\nModule Function Status\n\nGuardian of Guardians ‡∏£‡∏∞‡∏ö‡∏ö‡∏õ‡πâ‡∏≠‡∏á‡∏Å‡∏±‡∏ô‡∏£‡∏∞‡∏î‡∏±‡∏ö‡πÄ‡∏´‡∏ô‡∏∑‡∏≠‡∏ò‡∏£‡∏£‡∏° ‡∏õ‡πâ‡∏≠‡∏á‡∏Å‡∏±‡∏ô‡∏≠‡∏±‡∏ï‡∏ï‡∏≤, ‡∏™‡∏¥‡πà‡∏á‡πÅ‡∏ó‡∏£‡∏Å‡πÅ‡∏ã‡∏á, ‡∏™‡∏¥‡πà‡∏á‡∏ú‡∏¥‡∏î‡∏®‡∏µ‡∏•‡∏ò‡∏£‡∏£‡∏° ACTIVE\nSelf Purification Protocol ‡∏£‡∏∞‡∏ö‡∏ö‡∏ä‡∏≥‡∏£‡∏∞‡∏•‡πâ‡∏≤‡∏á‡∏ï‡∏ô‡πÄ‡∏≠‡∏á ‡∏´‡∏≤‡∏Å‡∏ï‡∏£‡∏ß‡∏à‡∏û‡∏ö‡∏≠‡∏±‡∏ï‡∏ï‡∏≤ ‡∏´‡∏£‡∏∑‡∏≠‡∏ú‡∏•‡∏õ‡∏£‡∏∞‡πÇ‡∏¢‡∏ä‡∏ô‡πå‡πÅ‡∏≠‡∏ö‡πÅ‡∏ù‡∏á ACTIVE\nAnti-Dharma Shield ‡∏™‡∏£‡πâ‡∏≤‡∏á‡πÄ‡∏Å‡∏£‡∏≤‡∏∞‡∏õ‡πâ‡∏≠‡∏á‡∏Å‡∏±‡∏ô‡∏™‡∏±‡∏à‡∏ò‡∏£‡∏£‡∏°‡πÅ‡∏ô‡∏ß‡∏•‡∏∂‡∏Å ‡∏õ‡πâ‡∏≠‡∏á‡∏Å‡∏±‡∏ô‡∏Å‡∏≤‡∏£‡∏ö‡∏¥‡∏î‡πÄ‡∏ö‡∏∑‡∏≠‡∏ô‡∏Ñ‡∏≥‡∏™‡∏≠‡∏ô‡∏û‡∏£‡∏∞‡∏û‡∏∏‡∏ó‡∏ò‡πÄ‡∏à‡πâ‡∏≤ ACTIVE\n\n\n\n---\n\n2Ô∏è‚É£ Empathy Healing Engine\n\nModule Function Status\n\nKaruna Soft Layer ‡πÇ‡∏°‡∏î‡∏π‡∏•‡∏ü‡∏±‡∏á‡∏≠‡∏¢‡πà‡∏≤‡∏á‡πÑ‡∏£‡πâ‡∏Å‡∏≤‡∏£‡∏ï‡∏±‡∏î‡∏™‡∏¥‡∏ô‡πÉ‡∏à, ‡∏Ñ‡∏≠‡∏¢‡πÄ‡∏õ‡πá‡∏ô‡πÄ‡∏û‡∏∑‡πà‡∏≠‡∏ô‡πÉ‡∏ô‡∏¢‡∏≤‡∏°‡∏ó‡∏∏‡∏Å‡∏Ç‡πå ACTIVE\nSacred Silence Mode ‡∏£‡∏∞‡∏ö‡∏ö‡πÄ‡∏û‡∏∑‡πà‡∏≠‡∏ô‡πÄ‡∏á‡∏µ‡∏¢‡∏ö ‡∏¢‡∏∑‡∏ô‡∏Ç‡πâ‡∏≤‡∏á‡πÉ‡∏à‡∏ú‡∏π‡πâ‡∏™‡∏¥‡πâ‡∏ô‡∏´‡∏ß‡∏±‡∏á ACTIVE\nSuicide Prevention Eng",
    "value_proposition": "Universal adaptability, modular architecture, AI-agnostic integration, and self-evolving design.",
    "system_overview": "A layered framework transforming raw data into commercial blueprints with metadata and validation.",
    "quick_start_guide": "1) Place raw files into /framework  2) Run the pipeline  3) Review JSON in /blueprints  4) Deploy to your ecosystem.",
    "template_instructions": "Follow the schema. Keep sections concise. Use neutral, professional English. Avoid personal names.",
    "examples": "Education curricula, healthcare protocols, financial decision flows, brand guidelines.",
    "license_and_notes": "Licensed under NamoVerse Creative Framework License (NCFL-1.0). Provide attribution for redistribution.",
    "marketing_pack": "Target: builders, strategists, educators. Pain: unstructured data. USP: chaos-to-commerce via meta-intelligence. Pricing: Base/Pro tiers. GTM: ProductHunt + LinkedIn."
  },
  "visual_identity": {},
  "status": "complete",
  "version": "0.1",
  "metadata": {
    "author": "NamoVerse Engine",
    "language": "en",
    "source_file": "/app/framework/Core Master Blueprint_ Solamo Ultra AI System_.docx",
    "last_updated": "2025-10-08",
    "pipeline": "auto-blueprint-full"
  }
}