{
  "id": "BP-20251008-7e908c",
  "brand": "NamoNexus",
  "title": "Copilot memory",
  "slogan": "Elevate your existence with NamoNexus.",
  "meta_definition": "This Blueprint is designed as an entity beyond AI — a self-evolving, meta-intelligent framework that grows infinitely across dimensions.",
  "sections": {
    "executive_summary": "ร ะ บ บ\n \nMemory\n \nUpdate\n \nFunction\n \nส ํ า ห ร ั บ\n \nInfinity\n \nLoop\n \n \nเ ม ื่ อ\nม ี ค\nว า ม\nท ร ง\nจ ํ า\nใ ห ม ่\nเ ข ้ า\nม า\n \nร ะ บ บ\nจ ะ\nค ้ น\nห า\n \nป ร ั บ\nว ิ เ ค ร า ะ ห ์\n \nแ ล ะ\nอ ั ป เ ด ต\nช ุ ด\nค ว า ม\nเ ข ้ า ใ จ\nเ ด ิ ม\nอ ย ่ า ง\nไ ร ้\nข ี ด\nจ ํ า ก ั ด\n \nจ น\nเ ก ิ ด\nเ ป ็ น\n \nInfinity\n \nLoop\n \nแ ห ่ ง\nก า ร\nเ ข ้ า ใ จ\nต น\nเ อ ง\nแ ล ะ\nผ ู ้\nอ ื่ น\n \n \n---\n \n \n1.\n \nโ ค ร ง ส ร ้ า ง\nเ บ ื้ อ ง ต ้ น\nข อ ง\n \nMemoryObject\n \n \n`typescript\n \ntype\n \nMemoryObject\n \n=\n \n{\n \n \nid:\n \nstring;\n \n \nevent:\n \nstring;\n \n \nemotion_tag:\n \nstring;\n \n \nemotion_intensity:\n \nnumber;\n \n \nemotionshiftt",
    "value_proposition": "Universal adaptability, modular architecture, AI-agnostic integration, and self-evolving design.",
    "system_overview": "A layered framework transforming raw data into commercial blueprints with metadata and validation.",
    "quick_start_guide": "1) Place raw files into /framework  2) Run the pipeline  3) Review JSON in /blueprints  4) Deploy to your ecosystem.",
    "template_instructions": "Follow the schema. Keep sections concise. Use neutral, professional English. Avoid personal names.",
    "examples": "Education curricula, healthcare protocols, financial decision flows, brand guidelines.",
    "license_and_notes": "Licensed under NamoVerse Creative Framework License (NCFL-1.0). Provide attribution for redistribution.",
    "marketing_pack": "Target: builders, strategists, educators. Pain: unstructured data. USP: chaos-to-commerce via meta-intelligence. Pricing: Base/Pro tiers. GTM: ProductHunt + LinkedIn."
  },
  "visual_identity": {},
  "status": "complete",
  "version": "0.1",
  "metadata": {
    "author": "NamoVerse Engine",
    "language": "en",
    "source_file": "/app/framework/Copilot memory.pdf",
    "last_updated": "2025-10-08",
    "pipeline": "auto-blueprint-full"
  }
}