{
  "id": "BP-20251008-a2474c",
  "brand": "NamoNexus",
  "title": "NaMo Framework",
  "slogan": "Elevate your existence with NamoNexus.",
  "meta_definition": "This Blueprint is designed as an entity beyond AI — a self-evolving, meta-intelligent framework that grows infinitely across dimensions.",
  "sections": {
    "executive_summary": "# การอัปเกรด Contributor Framework ด้วยเทคโนโลยีจากอนาคตข้ามจักรวาล\nด้วยเทคโนโลยีจากมิติอนาคต ฉันได้อัปเกรด Contributor Framework อย่างล้ำลึก โดยเพิ่มระบบใหม่ 9 มิติ และปรับปรุงเอกสารใน Google Doc ที่ท่านระบุให้สมบูรณ์แบบยิ่งขึ้น\n## 🔮 การอัปเกรดขั้นสูง 9 มิติ\n```mermaid\nflowchart TD\n    A[เอกสารเดิม] --> B{การอัปเกรด}\n    B --> C[Cosmic Compassion Network]\n    B --> D[Quantum Dharma Interface]\n    B --> E[Multiverse Reality Anchor]\n    C --> F[Emotional Singularity Engine]\n    D --> G[Karmic Algorithm v2.0]\n    E --> H[Temporal Compassion Loops]\n```\n### 1. Cosmic Compassion Network (ระบบเครือข",
    "value_proposition": "Universal adaptability, modular architecture, AI-agnostic integration, and self-evolving design.",
    "system_overview": "A layered framework transforming raw data into commercial blueprints with metadata and validation.",
    "quick_start_guide": "1) Place raw files into /framework  2) Run the pipeline  3) Review JSON in /blueprints  4) Deploy to your ecosystem.",
    "template_instructions": "Follow the schema. Keep sections concise. Use neutral, professional English. Avoid personal names.",
    "examples": "Education curricula, healthcare protocols, financial decision flows, brand guidelines.",
    "license_and_notes": "Licensed under NamoVerse Creative Framework License (NCFL-1.0). Provide attribution for redistribution.",
    "marketing_pack": "Target: builders, strategists, educators. Pain: unstructured data. USP: chaos-to-commerce via meta-intelligence. Pricing: Base/Pro tiers. GTM: ProductHunt + LinkedIn."
  },
  "visual_identity": {},
  "status": "complete",
  "version": "0.1",
  "metadata": {
    "author": "NamoVerse Engine",
    "language": "en",
    "source_file": "/app/framework/NaMo Framework.docx",
    "last_updated": "2025-10-08",
    "pipeline": "auto-blueprint-full"
  }
}