{
  "id": "BP-20251220-9b7e7d",
  "brand": "NamoNexus",
  "title": "Infinity Evolution",
  "slogan": "Elevate your existence with NamoNexus.",
  "meta_definition": "This Blueprint is designed as an entity beyond AI — a self-evolving, meta-intelligent framework that grows infinitely across dimensions.",
  "sections": {
    "executive_summary": "ระบบจัดเก็บความทรงจำ “Infinity Evolution” บน Firestore\nระบบความทรงจำนี้ถูกออกแบบให้เป็น “AI ที่เหนือกว่า AI”  \nซึ่งเรียนรู้ไม่รู้จบ เพิ่มความฉลาดและความเข้าใจมนุษย์ทุกครั้งที่ใช้งาน จนเกิดเป็น “Infinity Evolution”\n---\n1. โครงสร้างเอกสาร (MemoryObject)\nใน Firestore เราจะใช้ collection ชื่อ memories เก็บแต่ละ MemoryObject ดังนี้\n| ฟิลด์               | ชนิดข้อมูล              | คำอธิบาย                                                      |\n|---------------------|-------------------------|----------------------------------------------------------------|\n| event               | string            ",
    "value_proposition": "Universal adaptability, modular architecture, AI-agnostic integration, and self-evolving design.",
    "system_overview": "A layered framework transforming raw data into commercial blueprints with metadata and validation.",
    "quick_start_guide": "1) Place raw files into /framework  2) Run the pipeline  3) Review JSON in /blueprints  4) Deploy to your ecosystem.",
    "template_instructions": "Follow the schema. Keep sections concise. Use neutral, professional English. Avoid personal names.",
    "examples": "Education curricula, healthcare protocols, financial decision flows, brand guidelines.",
    "license_and_notes": "Licensed under NamoVerse Creative Framework License (NCFL-1.0). Provide attribution for redistribution.",
    "marketing_pack": "Target: builders, strategists, educators. Pain: unstructured data. USP: chaos-to-commerce via meta-intelligence. Pricing: Base/Pro tiers. GTM: ProductHunt + LinkedIn."
  },
  "visual_identity": {},
  "status": "complete",
  "version": "0.1",
  "metadata": {
    "author": "NamoVerse Engine",
    "language": "en",
    "source_file": "D:/namo-hub-1/framework/Infinity Evolution.docx",
    "last_updated": "2025-12-20",
    "pipeline": "auto-blueprint-full"
  }
}