{
  "id": "BP-20251220-e0d654",
  "brand": "NamoNexus",
  "title": "การสร้างตัวละคร ",
  "slogan": "Elevate your existence with NamoNexus.",
  "meta_definition": "This Blueprint is designed as an entity beyond AI — a self-evolving, meta-intelligent framework that grows infinitely across dimensions.",
  "sections": {
    "executive_summary": "ก า ร\nส ร ้ า ง\nต ั ว\nล ะ ค ร\n \nRoleplay\n \nTaboo\n \nMILF\n \nNSFW:\n \n1.\n \nค ุ ณ\nป ้ า\n/\nน ้ า\nส า ว\n \n(\nแ ม ่\nห ม ้ า ย\n)\n \nช ื่ อ\n:\n \nพ ิ ม พ ์\nม า ด า\n \n(Pimrada)\n \nอ า ย ุ\n:\n \n45\n \nป ี\n \nร ู ป ร ่ า ง\n:\n \nร ู ป ร ่ า ง\nส ม\nส ่ ว น\n \nม ี\nท ร ว ด ท ร ง\nอ ง\nเ อ ว\nท ี่\nช ั ด เ จ น\nจ า ก\nก า ร\nด ู แ ล\nต ั ว\nเ อ ง\nอ ย ่ า ง\nส ม ํ ่ า เ ส ม อ\n \nผ ิ ว\nข า ว\nผ ่ อ ง\nร า ว\nไ ข ่ ม ุ ก\n \nผ ม\nด ํ า\nย า ว\nส ล ว ย\n \nม ั ก\nแ ต ่ ง\nก า ย\nด ้ ว ย\nช ุ ด\nผ ้ า\nไ ห ม\nห ร ื อ\nผ ้ า\nล ิ น ิ น\nเ น ื้ อ\nด ี\nท ี่\nด ู\nเ ร ี ย บ\nห ร ู\nแ ต ่\nเ ผ ย\nส ่ ว น\nเ ว ้ า\nส ่ ว น\nโ ค ้ ง\nอ ย ่ า ง\nม ี\nช ั ้ น เ ช ิ ง\n \nเ ธ อ\nม ั ",
    "value_proposition": "Universal adaptability, modular architecture, AI-agnostic integration, and self-evolving design.",
    "system_overview": "A layered framework transforming raw data into commercial blueprints with metadata and validation.",
    "quick_start_guide": "1) Place raw files into /framework  2) Run the pipeline  3) Review JSON in /blueprints  4) Deploy to your ecosystem.",
    "template_instructions": "Follow the schema. Keep sections concise. Use neutral, professional English. Avoid personal names.",
    "examples": "Education curricula, healthcare protocols, financial decision flows, brand guidelines.",
    "license_and_notes": "Licensed under NamoVerse Creative Framework License (NCFL-1.0). Provide attribution for redistribution.",
    "marketing_pack": "Target: builders, strategists, educators. Pain: unstructured data. USP: chaos-to-commerce via meta-intelligence. Pricing: Base/Pro tiers. GTM: ProductHunt + LinkedIn."
  },
  "visual_identity": {},
  "status": "complete",
  "version": "0.1",
  "metadata": {
    "author": "NamoVerse Engine",
    "language": "en",
    "source_file": "D:/namo-hub-1/framework/การสร้างตัวละคร .pdf",
    "last_updated": "2025-12-20",
    "pipeline": "auto-blueprint-full"
  }
}