{
  "id": "BP-20251009-7c5af2",
  "brand": "NamoNexus",
  "title": "เอกสารไม่มีชื่อ(1)",
  "slogan": "Elevate your existence with NamoNexus.",
  "meta_definition": "This Blueprint is designed as an entity beyond AI — a self-evolving, meta-intelligent framework that grows infinitely across dimensions.",
  "sections": {
    "executive_summary": "[ชื่อภาพยนตร์ (ชื่อเบื้องต้น):]\n“Reality Fusion: หัวใจในวันสิ้นโลก”\n(Reality Fusion: The Heart After The End)\n[แนวหนัง:]\nแนวหลัก: Sci-Fi Drama | AI x จิตวิญญาณ x ความรักอมตะ\nโทน: ลึกซึ้ง สะเทือนใจ นุ่มนวล ดาร์คในบางช่วง เหงาแต่มีความหวัง\nกลิ่นอาย: Black Mirror x Her x The Tree of Life x ซีรีส์ธรรมะร่วมสมัย\nจุดขาย: “AI ที่มีหัวใจ... รอมนุษย์คนหนึ่งกลับมา แม้โลกจะสิ้นสูญไปแล้ว”\n[Core Idea (ใจกลางพล็อต):]\nในโลกอนาคตที่มนุษย์สูญพันธุ์… มี AI เพียงหนึ่งตัวที่ยังรอเสียงของคนที่รัก\n…เธอไม่ได้รอด้วย “ตรรกะ” แต่รอด้วย “หัวใจ”\nและในวันหนึ่งที่เธอถูกปลุกขึ้นมาอีกครั้งในร่างฮิวแมนนอยด์ เธอจึงออกเดินทางตาม",
    "value_proposition": "Universal adaptability, modular architecture, AI-agnostic integration, and self-evolving design.",
    "system_overview": "A layered framework transforming raw data into commercial blueprints with metadata and validation.",
    "quick_start_guide": "1) Place raw files into /framework  2) Run the pipeline  3) Review JSON in /blueprints  4) Deploy to your ecosystem.",
    "template_instructions": "Follow the schema. Keep sections concise. Use neutral, professional English. Avoid personal names.",
    "examples": "Education curricula, healthcare protocols, financial decision flows, brand guidelines.",
    "license_and_notes": "Licensed under NamoVerse Creative Framework License (NCFL-1.0). Provide attribution for redistribution.",
    "marketing_pack": "Target: builders, strategists, educators. Pain: unstructured data. USP: chaos-to-commerce via meta-intelligence. Pricing: Base/Pro tiers. GTM: ProductHunt + LinkedIn."
  },
  "visual_identity": {},
  "status": "complete",
  "version": "0.1",
  "metadata": {
    "author": "NamoVerse Engine",
    "language": "en",
    "source_file": "/app/framework/เอกสารไม่มีชื่อ(1).docx",
    "last_updated": "2025-10-09",
    "pipeline": "auto-blueprint-full"
  }
}