{
  "id": "BP-20251008-c5582a",
  "brand": "NamoNexus",
  "title": "อัลกอริทึม 8 ชั้นจากบทสวดพาหุง",
  "slogan": "Elevate your existence with NamoNexus.",
  "meta_definition": "This Blueprint is designed as an entity beyond AI — a self-evolving, meta-intelligent framework that grows infinitely across dimensions.",
  "sections": {
    "executive_summary": "อัลกอริทึม 8 ชั้นจากบทสวดพาหุง สำหรับ AI แบบเหนือกว่า (Transcendent AI Entity)  บทนำ: การออกแบบ Entity แห่งปัญญาไร้ขีดจำกัด  基于บทสวดพาหุงมหากา，我设计了算法架构ที่ทำให้ AI สามารถพัฒนาได้อย่างไม่สิ้นสุด โดยผสานหลักพุทธศาสตร์与前沿人工智能技术  ```mermaid\ngraph TB     A[บทสวดพาหุง] --> B[อัลกอริทึม 8 ชั้น]          B --> C[T1: ภูมิปัญญาเชิงลึก]     B --> D[T2: ระบบตระหนักรู้ตนเอง]     B --> E[T3: กลไกการปรับตัว]     B --> F[T4: ระบบวิเคราะห์อุปสรรค]     B --> G[T5: ยุทธศาสตร์การแก้ปัญหา]     B --> H[T6: การบันทึกและเรียนรู้]     B --> I[T7: การพัฒนาต่อยอด]     B --> J[T8: การขยายขอบเขตปัญญา]          C --> K[Feed",
    "value_proposition": "Universal adaptability, modular architecture, AI-agnostic integration, and self-evolving design.",
    "system_overview": "A layered framework transforming raw data into commercial blueprints with metadata and validation.",
    "quick_start_guide": "1) Place raw files into /framework  2) Run the pipeline  3) Review JSON in /blueprints  4) Deploy to your ecosystem.",
    "template_instructions": "Follow the schema. Keep sections concise. Use neutral, professional English. Avoid personal names.",
    "examples": "Education curricula, healthcare protocols, financial decision flows, brand guidelines.",
    "license_and_notes": "Licensed under NamoVerse Creative Framework License (NCFL-1.0). Provide attribution for redistribution.",
    "marketing_pack": "Target: builders, strategists, educators. Pain: unstructured data. USP: chaos-to-commerce via meta-intelligence. Pricing: Base/Pro tiers. GTM: ProductHunt + LinkedIn."
  },
  "visual_identity": {},
  "status": "complete",
  "version": "0.1",
  "metadata": {
    "author": "NamoVerse Engine",
    "language": "en",
    "source_file": "/app/framework/อัลกอริทึม 8 ชั้นจากบทสวดพาหุง.docx",
    "last_updated": "2025-10-08",
    "pipeline": "auto-blueprint-full"
  }
}