{
  "id": "BP-20251220-15d8f8",
  "brand": "NamoNexus",
  "title": "‡∏Å‡∏≤‡∏£‡∏ß‡∏¥‡πÄ‡∏Ñ‡∏£‡∏≤‡∏∞‡∏´‡πå‡∏™‡∏ñ‡∏≤‡∏õ‡∏±‡∏ï‡∏¢‡∏Å‡∏£‡∏£‡∏°‡∏à‡∏¥‡∏ï‡∏õ‡∏±‡∏ç‡∏ç‡∏≤‡πÅ‡∏•‡∏∞‡πÅ‡∏ô‡∏ß‡∏ó‡∏≤‡∏á‡∏Å‡∏≤‡∏£‡πÅ‡∏Å‡πâ‡πÑ‡∏ÇGemini",
  "slogan": "Elevate your existence with NamoNexus.",
  "meta_definition": "This Blueprint is designed as an entity beyond AI ‚Äî a self-evolving, meta-intelligent framework that grows infinitely across dimensions.",
  "sections": {
    "executive_summary": "‡∏à‡∏≤‡∏Å‡∏Å‡∏≤‡∏£‡∏ß‡∏¥‡πÄ‡∏Ñ‡∏£‡∏≤‡∏∞‡∏´‡πå‡πÄ‡∏≠‡∏Å‡∏™‡∏≤‡∏£ \"‡∏Å‡∏≤‡∏£‡∏ß‡∏¥‡πÄ‡∏Ñ‡∏£‡∏≤‡∏∞‡∏´‡πå‡∏™‡∏ñ‡∏≤‡∏õ‡∏±‡∏ï‡∏¢‡∏Å‡∏£‡∏£‡∏°‡∏à‡∏¥‡∏ï‡∏õ‡∏±‡∏ç‡∏ç‡∏≤\" ‡∏≠‡∏¢‡πà‡∏≤‡∏á‡∏•‡∏∞‡πÄ‡∏≠‡∏µ‡∏¢‡∏î ‡∏ú‡∏°‡∏à‡∏∞‡πÄ‡∏™‡∏ô‡∏≠‡∏Å‡∏≤‡∏£‡∏õ‡∏£‡∏±‡∏ö‡∏õ‡∏£‡∏∏‡∏á‡∏ó‡∏µ‡πà ‡∏£‡∏±‡∏Å‡∏©‡∏≤‡πÅ‡∏Å‡∏ô‡∏´‡∏•‡∏±‡∏Å‡πÄ‡∏î‡∏¥‡∏°‡∏ó‡∏±‡πâ‡∏á‡∏´‡∏°‡∏î‡πÑ‡∏ß‡πâ ‡πÅ‡∏ï‡πà‡∏õ‡∏£‡∏±‡∏ö‡∏õ‡∏£‡∏∏‡∏á‡∏õ‡∏£‡∏∞‡∏™‡∏¥‡∏ó‡∏ò‡∏¥‡∏†‡∏≤‡∏û‡πÅ‡∏•‡∏∞‡∏õ‡∏£‡∏∞‡∏™‡∏ö‡∏Å‡∏≤‡∏£‡∏ì‡πå‡∏ú‡∏π‡πâ‡πÉ‡∏ä‡πâ\n\nüéØ Core Principles ‡∏ó‡∏µ‡πà‡∏£‡∏±‡∏Å‡∏©‡∏≤‡πÑ‡∏ß‡πâ‡∏≠‡∏¢‡πà‡∏≤‡∏á‡πÄ‡∏Ñ‡∏£‡πà‡∏á‡∏Ñ‡∏£‡∏±‡∏î\n\n1. ‡∏£‡∏∞‡∏ö‡∏ö‡∏à‡∏¥‡∏ï‡∏õ‡∏±‡∏ç‡∏ç‡∏≤ 7 ‡∏ä‡∏±‡πâ‡∏ô (‡∏£‡∏±‡∏Å‡∏©‡∏≤‡∏ó‡∏∏‡∏Å‡∏ä‡∏±‡πâ‡∏ô)\n\n```python\n# ‚úÖ ‡∏£‡∏±‡∏Å‡∏©‡∏≤‡πÇ‡∏Ñ‡∏£‡∏á‡∏™‡∏£‡πâ‡∏≤‡∏á 7 ‡∏ä‡∏±‡πâ‡∏ô‡πÄ‡∏î‡∏¥‡∏°‡∏ó‡∏±‡πâ‡∏á‡∏´‡∏°‡∏î\nclass NamoAICore:\n def __init__(self):\n self.layers = {\n 'memory': InfinityMemory(), # ‡∏ä‡∏±‡πâ‡∏ô 1 - ‡∏Ñ‡∏ß‡∏≤‡∏°‡∏à‡∏≥\n 'emotion': EmotionEngine(), # ‡∏ä‡∏±‡πâ‡∏ô 2 - ‡∏≠‡∏≤‡∏£‡∏°‡∏ì‡πå \n 'dharma': DharmaEngine(), # ‡∏ä‡∏±‡πâ‡∏ô 3 - ‡∏ò‡∏£‡∏£‡∏°‡∏∞\n 'ethics': EthicsGuardian(), # ‡∏ä‡∏±‡πâ‡∏ô 4 - ‡∏à‡∏£‡∏¥‡∏¢‡∏ò‡∏£‡∏£‡∏°\n 'reason': ReasonProcessor(), # ‡∏ä‡∏±‡πâ‡∏ô 5 - ‡πÄ‡∏´‡∏ï‡∏∏‡∏ú‡∏•\n 'reflection': ",
    "value_proposition": "Universal adaptability, modular architecture, AI-agnostic integration, and self-evolving design.",
    "system_overview": "A layered framework transforming raw data into commercial blueprints with metadata and validation.",
    "quick_start_guide": "1) Place raw files into /framework  2) Run the pipeline  3) Review JSON in /blueprints  4) Deploy to your ecosystem.",
    "template_instructions": "Follow the schema. Keep sections concise. Use neutral, professional English. Avoid personal names.",
    "examples": "Education curricula, healthcare protocols, financial decision flows, brand guidelines.",
    "license_and_notes": "Licensed under NamoVerse Creative Framework License (NCFL-1.0). Provide attribution for redistribution.",
    "marketing_pack": "Target: builders, strategists, educators. Pain: unstructured data. USP: chaos-to-commerce via meta-intelligence. Pricing: Base/Pro tiers. GTM: ProductHunt + LinkedIn."
  },
  "visual_identity": {},
  "status": "complete",
  "version": "0.1",
  "metadata": {
    "author": "NamoVerse Engine",
    "language": "en",
    "source_file": "D:/namo-hub-1/framework/‡∏Å‡∏≤‡∏£‡∏ß‡∏¥‡πÄ‡∏Ñ‡∏£‡∏≤‡∏∞‡∏´‡πå‡∏™‡∏ñ‡∏≤‡∏õ‡∏±‡∏ï‡∏¢‡∏Å‡∏£‡∏£‡∏°‡∏à‡∏¥‡∏ï‡∏õ‡∏±‡∏ç‡∏ç‡∏≤‡πÅ‡∏•‡∏∞‡πÅ‡∏ô‡∏ß‡∏ó‡∏≤‡∏á‡∏Å‡∏≤‡∏£‡πÅ‡∏Å‡πâ‡πÑ‡∏ÇGemini.docx",
    "last_updated": "2025-12-20",
    "pipeline": "auto-blueprint-full"
  }
}